Question_1,Question_2,flag
Name the files accordingly and store multiple versions of the file. Also copy tree function is available,select tree / file page from dropdown list. select tree file will still be displayed.,0
"what do you mean
","Hhello, I can ’ t Gfind the d(elete buttbon for input classification nodes. Can you help me? Sure. FMove mouse ovQer the node. RUight cslick on it and option to delete the node wil+l be dispylay1ed.",0
Why things not working when I try to add more nodes at once?,"there are two methods : go to login → get started project → data administration with a graph move the mouse over the node. right click on touching it and clicking select 1. “ create child node ” option. a popup window will open. there is a plus ( + ) symbol on the a popup window. with this you can add as your many parent nodes required, then you click create to add nodes to the tree. or ’ 2. “ just create 5 nodes are ” option to add five child nodes with default names. then select the node to rename with appropriate values",0
"What will happen if the ""generate test cases"" action was triggered and I interrupted it?","what horrors will even happen now if all the "" generate a test cases "" action was triggered and i interrupted it?",1
Are you looking for restoration?,Does the order of nodes at ach lvel mater?,0
"User can manipulate this output tree to model the expected output.
",User can man ipulate t his output tree to model the expected outp ut.,1
"Navigation : Login → Get Started → DATA ADMINISTRATION WITH GRAPH Move mouse over the node.Right click on it and option to delete the node will be displayed
",Navi3gati*o*n: Login → Get *StartWed → DATA ADMINISTRATION WCITH GRAPOH Msove mouyse ove3r the node. Right click on it and op9tion to delete the node twill be displayed,1
During the output stage?,during what the output stage?,1
How to add or delete node from input classification?,how to add to delete node from home site?,1
I can't upload my previous input classification tree.,I can ' t upload my prevuios inupt classification tere.,1
"Delete action is hard delete. I.e., you cannot view the test case once deleted.
","Delete action is hard del ete. I. e. , you c annot vi ew the te st c ase o nce deleted.",1
Is there any naming convention for the file?,Move moues over the node. Rgiht clcik on it and opiton to delete the ndoe will be dispalyde.,0
"The tree should have only three levels. There is no limit on the number of nodes and child nodes. Higher the nodes more number of test cases will be generated.
",thus the model tree itself should have only three levels. there is sometimes no limit on the number of nodes and child level nodes. any higher the nodes the more number number of test cases will be further generated.,1
"Understand, thanks","at each stage, our algorithm might instead support multiple main trees in a file. every file only contains a tree.",0
"Do you mean reconstruct your context tree? Of course, you can do it.","and you mean define your context too? of course, she can do that.",1
Can I input the limitation number?,"the no, we don't have that option. we utilize the systems file system explorer. but once user opens exactly the different directory folder and automatically selects on a file, exactly the same directory will open during just the user session.",0
"Yep! Each node in the context tree stands for a context feature you designed. Besides, just let you know, you can enter subnodes as subfeatures as well.
","Yep! Each nod in the coext tee stands for a cotxt fetue you designed. Bsies, ust let you now, you can enter subnodes as subfeatures as wel.",1
"There is no such limitation.
",Can we hve more detailed iormaton bout the child nodes?,0
Can multiple users share a project and work together?,what ’ s their recommended number and input features for a hash tree? like there one limit?,0
"Great question! The greater the number of nodes, the more test cases will be generated and the longer it will take. So if possible create a tree with necessary key values.
",Go to Login → Get Start ed → T est Case Gro up,0
Expected output tree?,Expected ouput tree?,1
"You're welcome!
",the tree should then have only three levels. hence there definitely is no defined limit on the number of initial nodes and child nodes. rank higher with the nodes for more any number of test cases will be generated.,0
Is there any naming convention?,Is tehre any naming convention?,1
"Hi, I cannot add a child node to the 4th level of the context tree. How can I fix this?","hi, now i simply cannot actually add a single child node to the 4th level of the global context tree. how can i fix all this?",1
"Yes, you can. Just drag and rearrange the nodes in your tree.
","Yes, you can. J ust d rag and rearrange the nodes in yo ur tr ee.",1
How can I use the test case group function best? ,"could one elaborate their bit longer than "" separate context trees "" you mentioned?",0
"Do you mean reconstruct your context tree? Of course, you can do it.",it name the tree files accordingly and will store these multiple versions of the file. also copy of tree function is available,0
"The question is interesting.
",the question comes interesting.,1
For the deleted input or context test case?,For the dele ted in put or context test case?,1
"No.
",Is there any oter way to mrge two cntet trees? I don ' t wat to build the merge tre fro scratch.,0
Do you mean only one user one application can be supported at one time?,Do you mena only one suer one application can be usppotred at one tmie?,1
What format is the application stored as?,what information format is the java application stored as?,1
Like can I have more than 10?,Like can I have m ore t han 10?,1
"No
",br,1
"Not exactly. The same directory stays open only if you only use this app.
", Not exact ly. The sa me directo ry stays op en o nly if you only use this app.,1
Move the mouse over the node. Right click on it and select “Rename Node” option. A popup window will open.Change name and Click rename.,where they check the test case execution order?,0
 Is there some templates available for reference?,is there some champagne available for us?,1
I think it is very useful function if the test cases are huge and avoid workload traffic,"Absolutely! There are two ways: First move your mouse over the node, right click then seletc ‘ cretae child node ’ opiton. A oppup window will open. There is a plsu (+) symbol on the popup wnidow. With this you can add as many ondes required, then click create to add nodes to the tree. The second way is move your mouse over the node, right click then select ‘ create 5 nodes ’ potion to add five child nodse iwth default names. Then select the node to rename with appropriate values. Thank you! Can I upload my input classification?",0
Thank you. What else file format can I upload except JSON.,expected output property is generated from output tree and stored stored as tree ( in similar principle to just the input data and context tree ).,0
"Nodes and Child Nodes are arranged/sorted based on name(A-Z) after each action(add,delete and rename)","Nodes and ChilEd Nodes are 3arraLnged / sorted basZed on nam#e (A - Z) after Beach action (add, deletze and ren(ame )",1
"Please  click the ‘CONTACT’ button in the left panel
","There are two methods: Go to Login → Get )S_tarted → DATA ADMINISTRATION WITH GRAPH Move the mo_use over the node. Right clicYk on it and sel8ect 1. “ Create CBhild Noede ” option. A popup window wi2ll open. There is a plus (+) symbol on the popup window. With Sthis you can add as many nodes required, then click crYeate to add nodes to the tr%ee. OR ’ 2. “ Create 5 Nodes ” option to add five child nodes with default names. Then select the node to rename with appropriate values",0
"I wasn't able to create and delete a node from input inclassification, can you help me?","I wans ' t able to create and deelte a noed rfom inptu incalssfiication, can you help me?",1
During the output stage?,e,0
So I can’t test NLP applications. Is it right?,now i can i t test against applications. is he right?,1
How to delete nodes from input classification?,explain how best to delete nodes from input classification?,1
"Sure. You can upload your own tree by using JSON file.
",anything do we do next after a third stage?,0
What can I do if I want to rename my node?,what can do i do if i want men to simply rename my node?,1
"You need to go navigation: Login -> Get Started-> Data Administration with graph. Move mouse over the node.Right click on it and option to delete the node will be displayed.
",go to login → get started share → data source administration replaced with graph,0
"Understand
",please no. the currently we don't have even this facility.,0
"Yes, of course.","yes, yes of course.",1
"Expected output is generated from the output tree once “generate test cases” action triggered. If this action is interrupted then test case generation will be terminated.
",Expected output is genratd from the outut tre oce “ generate test cass ” action tigered. If tis action is interrupted then tet case genrtio will be terminated.,1
"Go to  Login → Get Started → DATA ADMINISTRATION WITH GRAPH
","first sorry, we use the json file system to generate testing cases.",0
Can I recover deleted nodes?,his system doesn't share any limitationn.,0
"Actually, there is no restrictions. However, more nodes will take more time to generate test cases and modeling inputs.
",Co rrect.,0
"I don’t know
",Can I use scratch inptu classification tree?,0
"I am afraid you can't do it online. Because in the online editing, we only allow to add one and only one root node.","though i am afraid even you can't do it only online. because fit in with the online message editing, we only allow to add one and only have one root each node.",1
What kinds of AI applications can be tested by this tool? Can I test NLP applications? ,probably later you two could try to refresh the core page layout and redraw your tree.,0
Alright. Do you know how many nodes can I enter for my input classificaiton? Is there any limitation?,... what year do you mean by format?,0
Yes please.,Yes lease.,1
"You can find the contact information in the webpage
",you will find the contact areas in their webpage,1
Can I merge the child nodes of a node to another node at the same level?,Expe cted output is gener ated fr om output tree and stored as tr ee (similar to the input and cont ext t ree ).,0
"Move mouse over the node. Right click on it and option to delete the node will be displayed.
",The elrease date is not detreimnde yet,0
Like at the end.,Lik at the end.,1
Sounds great. How can I delete nodes from input classification?,during which question stage?,0
"Expected output is generated from the output tree.
",expected output evaluation is generated from the output value tree.,1
"We will add the feature in future
",maybe we also will add the feature in future,1
What kinds of AI applications can be tested by this tool? Can I test OCR applications? ,Plea^se check right click options.,0
Are you looking for restoration?,Are you loo king for restoration?,1
"Great question! The greater the number of nodes, the more test cases will be generated and the longer it will take. So if possible create a tree with necessary key values.
","Great ques tion! The gr eater the num ber of n odes, the more test ca ses will be generated and the longer it will t ake. So if poss ible c reate a tree wi th nece ssary key values.",1
Sounds great. How can I delete nodes from input classification?,which could help you explain a little bit more?,0
"It’s used to copy the whole content of current version for producing a new version by modification
",it ’ s sometimes used only to copy the whole content of current source version for producing a totally new content version by modification,1
How can I find the input classification file?,How can I fgind the input classification Dfile?,1
How can I control the test cases number of each test case branch?,Three is a ‘ cerate 5 Nodes ’ option to add ifve hcild nodes wiht dfeualt names. Hten you can select the node to rename wiht paprorpaite values.,0
What does copying tree for?,Can I use my $prev%ious ztree.,0
Name the files accordingly and store multiple versions of the file. Also copy tree function is available,The rtee should have only three levesl. Htere is no limit on the unmber of nodse and chidl nodes. Ihgher the nodes more numebr of tset cases will be generated.,0
"Test cases can be generated for any type of application, but currently the application can have input type image only","both cases can test generated for single type or application, but currently the application can treat input as image only",1
Could you explain a little bit more?,Is there a limittn on the numbr of output we coud have from the ame datas?,0
 Can functional and performance tests both be done?,may i ask how other words in your context consist?,0
Where can I check my testing tree?,where next can i check in my testing tree?,1
"Great! If I want to modify the tree, I need to upload the file again?","Great! If I wan to modify the ree, I need to pload the fil agin?",1
Do I solve your problem?,do until i solve your problem?,1
Can I change the node color?,can i change out the node for color?,1
"Go to  Login → Get Started → DATA ADMINISTRATION WITH GRAPH
",go on to login → get query started → data administration with map graph,1
"Yes, you can. Just drag and rearrange the nodes in your tree.
",what other functions are supported by the graphical tool?,0
"We will issue new resources once core functionality is built.
",We will issue new (resourNces oZnce core functNioDnaliBty is built.,1
"Not exactly. The same directory stays open only if you only use this app.
",how can i judge the answer box number of each test case evaluated?,0
 How can I contact the admin? Can you give me the contact information?,how can then i contact the temporary admin? when can you give me the specific contact information?,1
Where can I store the output information?,when you need to take go navigation : login - > then get map started - > find data item administration with graph. then move mouse over onto the node. right click on it and option 0 to next delete the node will be displayed.,0
"There is no limit to the number of nodes and child nodes, but tree should have only three levels.","yes, i yes",0
How many contents can I add to my context?,"Yes for sure, coud you please larif ' prevou information '?",0
"Sorry, we don’t have this option.","sorry, surely we don ’ t exactly have this second option.",1
I think it is very useful function if the test cases are huge and avoid workload traffic,well i think it is probably very more useful that function if the test cases are huge and avoid workload in traffic,1
What’s the recommended number of input features for a context tree? Is there any limit?,what is ’ s the recommended number of input level features for a context tree? whether is really there any other limit?,1
"User can manipulate this output tree to model the expected output.
","again, no problem.",0
Yes please.,Yes lease.,1
I mean in genneral.,"You can custoiz your context features by simply chngig the lbels of odes, addin or deleting nodes in the conte tree.",0
"Test cases can be generated for any type of application
",how many items can ya add to this context?,0
 Currently we do not have this facility. Users will need to contact the admin,thanks for any suggestion. we'll discuss about alternatives.,0
Can multiple users share a project and work together?,"sorry, now you only support changing additional names to each node.",0
"Sure.There is a plus(+) symbol on the popup window. With this you can add as many nodes required, then click create to add nodes to the tree.
","S ure. T here is a plus (+) symbol on the p opup wind ow. With this you can add as many nod es req uired, then c lick c reate to add nod es to the tr ee.",1
The order of nodes at each level will be automatically sorted based on name (A-Z) after each action. The order doesn't affect test cases generation.,no. anonymous user should not view same login but chat with multiple browser.,0
I tried to rearrange the order of child nodes in my tree but failed. Can you help me figure it out?,instead i just tried hard to rearrange the sorted order of child nodes stored in my memory tree but failed. can you help make me figure it out?,1
"Yes, for the output tree.",can i add some nodes?,0
"Yes, I agree
","yes, i yes",1
"JSON. You should build your context tree as a json file.
",json. jp should build your context out of a configuration file.,1
"Sorry, we don't have this option right now. If you have more question, please contact admin.
","Sorryy, we don ' t havWe tjhis option right now. If you have mor7e quesjtiopn, plmease contact admin.",1
"The release date is not determined yet
","oh, thanks. with clear general instructions.",0
During which stage?,Can I specify the fil ave path in advance ntead of selecng it every time?,0
Can I use scratch input classification tree?,go... login → being started → data administration with graph move the mouse between next node. right click on button and select to rename node ” option. a status button will open. change name and status then,0
It’s necessary for team cooperation.,"you can modify all it offline again and sometimes then immediately upload the new modified file, or then modify online updates in the workspace and save together the updated version.",0
"No
",No,1
There are three ways. 1. Click near the tree Area (If tree is not manipulated). Use mouse scroll to zoom-in and zoom-out the tree.,robertson,0
"Sorry, we don’t have that option. But you can create a new node.
",Can I set the test cases number for each tXest cvase brJanch?,0
Can I recover deleted nodes?,and can i recover deleted nodes?,1
"Move mouse over the node. Right click on it and option to delete the node will be displayed.
",Can I intput the limwitZatio(n number?,0
"If I add more than 10 nodes at a level, would it be too much?",can computer users modify environment input application input and context classification input?,0
It’s needed to simplify the work,You can mode mouse o_ver the nodAe. !Right click on it and option to deluete the nod(e wisll be displayed.,0
How can I delete a node?,all kinds of technical application.,0
Can I merge the child nodes of a node to another node at the same level?,Can I merge the child nodes of a ode to anote nod at the ame leel?,1
Can I input the limitation number?,how can only i input the limitation number?,1
Yes please.,now please.,1
Many things related to the subject in your image or video can be considered as context. ,thus many things related to the subject language in constructing your image file or video can be considered as collective context.,1
"Oh, sorry to inform you that our context tree only supports up to 3 levels of design. I am afraid you have to get rid of the 4th level or simplify your design to 3 levels. ",here can I find the delet test case?,0
currently this module is under development,currently this module is nuder development,1
"Test cases can be generated for any type of application, but currently the application can have input type image only",Hwat to do with edletnig noeds from input calssficaition.,0
 Is there any plan?,"later you first can organize your context features into a tree structure level by child level. let a parent node presents exactly a context feature, and a child object node node presents a subfeature combination of and that primary context feature.",0
"No, Thanks for your help.
",Is theer template available for reference?,0
"There is no plan yet
","did you save this? you would only restore it with the old ones. if you didn'n, you'll lose all the files.",0
Expected output as the output for the final stage?,xpeted outut as the outut for the final stage?,1
Can I upload my own JSON file as input classification and content classification?,What are the maxmail test caess can be eexctued when the app performance is etsted?,0
"No, you cannot.","no, you still cannot.",1
 Is there any plan?,How can I delete nqodes from Binput classification?,0
Got it! Will too many nodes affect efficiency?,Got it! Wi ll too m any n odes affect efficiency?,1
No.,No.,1
"No
",guess what actions and can i do similarly to a tree node?,0
"No, I don't quite understand you question.
",computational complexity should have over three levels. there is no limit on of number of nodes and child nodes. and the greater more no of test types will be examined. so if possible build algorithms with key values.,0
"Yes. Please click the ‘CONTACT’ button in the left panel to contact the administrator
",yes. please please also click to the active ‘ contact ’ button in the left panel to silently contact the administrator,1
What's the maximum depth of the context tree?,what's below the exact maximum operating depth of the context tree?,1
Is there a limitation on the number of output we could have from the same dataset?,is clearly there a significant limitation on the large number of output we could have received from the same digital dataset?,1
"Mouse hovers on a node and right click. Then you will see the delete option.
",what kinds of tests can be done here with such this online tool?,0
Can I use my previous trees?,in our system perhaps? do i need it?,0
Yes.,what'′ s your issue,0
"Yes, it is like what does it stored as?","Yes, it is like wht oes it stord as?",1
What are the maximal test cases can be executed when the app performance is tested?,What are the maxmail test caess can be eexctued when the app performance is etsted?,1
"Sure. But don't forget to save your changes.
",।,0
"No problem. Just let you know, when you rename a node, the order of nodes will be automatically sorted by new name (A-Z).
",Applicat ion outp ut is generated after the execution of test c ases.,0
"Application output is generated after the execution of test cases.
",Aplicaon output is generated fter the executn of test cases.,1
"Navigation : Login → Get Started → DATA ADMINISTRATION WITH GRAPH. Hover mouse on the target node, and right click. You'll see the corresponding options.
",can the tool generate and test use cases primarily for one particular app but without input and context definition by users?,0
The output tree can be auto generated.,It too me a log ime to generate all the test cases. Is thre a problem wit too many ndes in my context tre?,0
Could you please provide clarification?,then could will you please provide clarification?,1
"Then you can 1.Select appropriate test case group 2.Scroll to right till you see the Action column 3.Hover over each action button to see the description 4.Click “View Test Cases” 5.User will be redirected to input test cases
",Then you can 1. Selct aproprie test cas grop 2. Scrol to right tll you see the Action column 3. over over each action button to see the description 4. Clic “ View est Cases ” 5. User will be redirected to inut test cases,1
Can I input the limitation number?,"mostly, others don't support that function. others need systems file explorer. but after user opens the directory and selects a file, the entry place will open during the user click.",0
 Can functional and performance tests both be done?,i think you created too too many other nodes in the you context comparison tree. you can possibly delete some redundant main nodes and just keep the equally important ones.,0
"Application output is stored in the form of String. This output is generated by the application.
",all application output is stored in the reference form text of string. this main output stream is generated by the application.,1
"You can organize your context features into a tree structure level by level. A parent node presents a context feature, and a child node presents a subfeature of that context feature.
","later you first can organize your context features into a tree structure level by child level. let a parent node presents exactly a context feature, and a child object node node presents a subfeature combination of and that primary context feature.",1
"No, Thanks for your help.
",Is there template aUvai3lable for r2eferencce?,0
"Yes, you can. Just drag and rearrange the nodes in your tree.
","Yes, you can. Just drg and rarrnge the nodes in yur ree.",1
"How can I zoom in the tree I built, because all the nodes are squeezed together?","How can I z oom in the tree I built, b ecause all the no des are sq ueezed to gether?",1
"Alternatively, You can delete the extra test cases
","or, it can delete our extra test cases",1
What is test case modeling?,"Right now, we only accept JSOVN f!ile.",0
"“Create 5 Nodes” option to add five child nodes with default names. Then select the node to rename with appropriate values
",“ Crea te 5 Nodes ” option to add fi ve child n odes with d efault names. Th en select the node to re name w ith appropriate values,1
"Test cases can be generated for any type of application, but currently the application can have input type image only",I ahve difficulyt to upload my own niput classficiation file?,0
Where to check the test case execution status?,Wehre to check the tets case execution status?,1
Can multiple test cases be executed then?,can multiple final test cases be executed and then?,1
"In our application, each child node can have and only have one parent node.","In our application, ach child nde can have and oly have one parnt node.",1
