Question_1,Question_2,flag
"Expected output is generated from the output tree. Application output is generated after the execution of test cases. Expected output tree will be used to compare actual application output to rate the quality。
",3. Double c lick ne ar the t ree to zoom - in.,0
"I understand
","no ok, got it! then i will definitely modify it.",0
Do you have a JSON file?,do humans share a json file?,1
"You can simply provide input for the test cases and then perform the execute test case action.
",what type of input software classification file system can am i upload?,0
No,No,1
Is there any limit to the number of nodes that I can enter?,Is there any limit to the numer of odes tht I can eter?,1
How to fix submission button doesn't work?,How to fix su_b&mis*sion butt&on xdoesn ' t work?,1
"The tree should have only three levels.
",sure. next you both can uplaod your own json membership file.,0
Is there any naming convention?,would one add multiple nodes to my context map at once?,0
"Yes, you can go to Login-> Get Started -> TEST CASE GROUP, then select appropriate test case group, scroll to right till you see the action column. Hover over each action button to see the description, click ‘View Test Cases’. Then you will be redirected to input test cases. Did I solve your problem?","Yes, you can go to Logni -> Get Started -> TEST CASE GROUP, then select aprpopiraet etst case group, scroll to right till you see the action column. Hovre ovre each action button to see the description, click ‘ View Tets Cases ’. Thne you will be erdirteced to input tset cases. Did I slove your problem?",1
"You need to go navigation: Login -> Get Started-> Data Administration with graph. Move mouse over the node.Right click on it and option to delete the node will be displayed.
",i need also go see : message - > get information - > data administration with graph. move mouse over the node. right click on it new option or text that node to be displayed.,1
Can I delete nodes from input classification?,can so i delete nodes from each input classification?,1
Is there a limitation on the number of output we could have from the same dataset?,Is th ere a limita tion on the number of output we co uld ha ve from the sa me dataset?,1
"I have a problem of uploading my input classification, how can I fix it?","I have a FproblEem of uploUad)ing my 0input Aclasshifficatiopn, how can I fix it?",1
"Actually, there is no restrictions. However, more nodes will take more time to generate test cases and modeling inputs.
",Corec.,0
How can I customize my own context tree?,How can I customize my own cntet tre?,1
What is the difference between test case input modeling and input tree modeling?,"Right now, we ognly accept JQSON file.",0
"Go to  Login → Get Started → DATA ADMINISTRATION WITH GRAPH
",Go to Login → Get Stted → DTA ADMINISTRATION WTH GRAPH,1
"You can customize your context features by simply changing the labels of nodes, adding or deleting nodes in the context tree.",do you have a plan yet for leading this function?,0
"You can try it, but your usage may be interrupted during the usage
","Sorry, we don ' t hvae htat potion.",0
"Thank you for your help!
","sorry, we don't have any option available anymore. if patrons have no question, please call admin.",0
"I am sorry, the answer is YES.
","Yes, it is l ike wh at does it stor ed as?",0
"Yes
",can am i download the context mapping tree i built around on the app?,0
"No
",fucking no,1
How many contents can I add to my context?,test cases can anyone created for any type a application,0
Where can I find the option list you mentioned?,hank you!,0
"Yes. You can upload a JSON file.
",Can I set spZecifWic execution time for the tegst casJes?,0
There is a ‘create 5 Nodes’ option to add five child nodes with default names. Then you can select the node to rename with appropriate values.,There is a ‘ create 5 Nodets ’ opGtion to add five &child Pnodes wi@th dewfauolt rnames. Then you can select the node to rename witth mapproprKiat+e values.,1
"No.
",Do you mena only one suer one application can be usppotred at one tmie?,0
" Input and context tree modeling,Test case modeling and Test case input modeling.","I wans ' t able to create and deelte a noed rfom inptu incalssfiication, can you help me?",0
Could you please provide clarification?,Could you please provi de clarification?,1
We accept JSON file.,Copy tree is to copAy the vge^rsion,0
"Copy tree is to copy the tree
",Copy tere is to coyp the tree,1
Name the files accordingly and store multiple versions of the file. Also copy tree function is available,name the game twice and store multiple versions off the file. the copy recovery function is available,1
"Currently no
",CRurre0ntly no,1
"You can modify it offline and then upload the modified file, or modify online in the workspace and save the updated version.
","You can moify it offline and thn upload the modified fie, or mdify onlie in the workspace and save the uated versn.",1
"There is no nodes limitationn.
","i tried too organize an jason file, where can anyone see my career tree?",0
What can I do if I want to rename my node?,more can i do if i want to rename this baby?,1
How many parents can each child node have?,you can talk with his username and search,0
Would you provide detail information about it?,would you provide detail basic information about finding it?,1
"No
",The tree shou!ld have only three levels. KThere is no l4imit on the number of nodes and cuhild enodes. !Higher the 3nodes more no of tepst chases will be generated. So if possible create tre8es with key values.,0
Did you save it? You can only restore info from the saved tree.,version no. also user should not just use same login with client currently with no multiple browser.,0
"The more nodes, the more test cases will be generated. It will take a looooong time. So if possible delete some redundant nodes and just retain the key ones.
",what kinds of things were being done with this tool?,0
"Sorry, we don’t have this option.
","Sorry, we don ’ t haDve tZhis o*ption.",1
"Go to  Login → Get Started → Test Case Group
",go to login → assignment get started → test from case → group,1
Can I use my previous tree.,can we see my previous tree.,1
Could you please clarify what do you by the type?,ah yes.,0
"In the child node user can put all the possible output strings or output tree can be generated automatically based on the input and context tree.
","Th ere is no lim it to the nu mber of subfeat ures you can add. But be careful, our con text tr ee desi gn o nly supports up to 3 levels.",0
Where can I check my testing tree?,data output tree?,0
" Input and context tree modeling,Test case modeling and Test case input modeling.","Inpurt and c4ontOext tre0e modeling, Test case modeling and Test case 6input modeling.",1
It took me a long time to generate all the test cases. Is there a problem with too many nodes in my context tree?,no. only significant changes can be done,0
"Yes
","I tried to upload a Ajson file, hwere can I see my testing tere?",0
So I can’t test NLP applications. Is it right?,Thnaks for your help.,0
"Hello, how can I edit my nodes for input classification? Sure, you can edit or delete nodes. How many nodes can I add at most in one time?","hello, how can i edit my websites having no names? sure, you just do the delete nodes. very many nodes can be erase at most in one time?",1
Could you explain a little bit more?,this sounds just great. how can i delete nodes in from input classification?,0
"Sure, Navigation : Login → Get Started → DATA ADMINISTRATION WITH GRAPH  Move mouse over the node.Right click on it and option to delete the node will be displayed
",can x change the input stream context without generating the output tree when i reach the next stage? thus must i edit the data without saving values?,0
"You are welcome
",The 3tree should have 8only three levels. There is no limit on the number of nodehs and chilcd nodes. Higher the nodes more numRber of tesGt cadses wilRl be tgeneprated.,0
"You need to go navigation: Login -> Get Started-> Data Administration with graph. Move mouse over the node.Right click on it and option to delete the node will be displayed.
",go on to login → get query started → data administration with map graph,0
"You need to go navigation: Login -> Get Started-> Data Administration with graph. Move mouse over the node.Right click on it and option to delete the node will be displayed.
",It ’ s neces(safry for team coopezrattYion.,0
"JSON. You should build your context tree as a json file.
",SON. You should build your otext tree as a json fie.,1
"Yes. You can upload a JSON file.
",0. who can upload a search file.,1
"No.
",what can do i do if i want men to simply rename my node?,0
Do I solve your problem?,No. Only 4fun!ctioAnal tests can be don$e,0
"There is no such limitation.
",we will consider the wave function,0
When is application output generated?,T here are thr ee w ays. 1. Cli ck near the tr ee A rea (If tree is not manipu lated ). Use mouse sc roll to z oom - in and z oom - out the tree.,0
How can I achieve it?,how can chapter i do the version control of the input library and its context dependent classification input?,0
"Yes. You can upload a JSON file.
",Yes. You can puload a JSON flie.,1
What can I do if I want to check my input classification cases?,following : login → get started → hello stream or operation move it over the node. right hand on it and try to delete the node will automatically displayed,0
"Sure. You can uplaod your own JSON file.
",sure. even you kids can uplaod you your own json file.,1
I tried to rearrange the order of child nodes in my tree but failed. Can you help me figure it out?,Go to Logn → Get Started → Test ase Grou,0
What do you mean by format?,W hat do you me an by format?,1
Deleted from the Test Case Group?,"if ever i accidently delete at the critical node, can i recover from it?",0
How to delete nodes from input classification?,"delete of action is hard for delete. ex i. in e., you cannot view the new test case function once deleted.",0
May I ask how many nodes in your context tree?,may i ask how other words in your context consist?,1
Yes please.,"go to login - > get source - > return method. then a json file, call call type ( input, context or outputs ), get out.",0
Can I change the order of input classification?,WhaBt fVunctixons are supported by the tool?,0
"Yes, no problem.
","yes, for no problem.",1
What's the maximum depth of the context tree?,Do you ha ve a JS ON file?,0
How do we improve the invalid output?,where do we improve the energy output?,1
What type of input classification file can I upload?,Not suer,0
During the output stage right?,during the output of right?,1
"We will issue new resources once core functionality is built.
",we must issue new resources once core content is available.,1
Can I merge the nodes at level 2 and level 3 in my context tree?,Can I m erge the no des at level 2 and lev el 3 in my context tr ee?,1
"Application output is generated after the execution of test cases.
",Apliatin output is generated aftr the excutio of test cases.,1
"At this stage, our application does not support multiple context trees in a file. A file only contains a tree.
",Ther is no such limitationn.,0
"“Create Child Node” option. A popup window will open. There is a plus(+) symbol on the popup window. With this you can add as many nodes required,then click create to add nodes to the tree.
",what to even do if i really want to add more active nodes at once?,0
No.,br.,1
Why things not working when I try to add more nodes at once?,Wht do you mean by pperty?,0
Yes.,... yes.,1
"Oh, thanks. Clear instructions.","oh, thanks. with clear general instructions.",1
"What will happen if the ""generate test cases"" action was triggered and I interrupted it?","Wh at will happen if the "" gene rate t est c ases "" action was triggered and I inter rupted it?",1
Can I use my previous tree.,Hwat does copying tree for?,0
"There is no plan yet
",but there is no plan yet,1
Probably you could try to refresh the page and redraw your tree.,probably you could try to further refresh the cover page somewhat and the redraw your tree.,1
"Test cases can be generated for any type of application
",can i merge two context trees under a single definition altogether?,0
What kinds of tests can be done with this tool?,what kinds of tests can be done here with such this online tool?,1
"The tree should have only three levels. There is no limit on the number of nodes and child nodes. Higher the nodes more no of test cases will be generated.So if possible create trees with key values.
",No,0
How to fix submission button doesn't work?,how to fix submission or button it doesn't usually work?,1
"I am afraid you can't do it online. Because in the online editing, we only allow to add one and only one root node.","I am afrad you can ' t do it online. Because in the onlne eting, we nly allw to add one and oly one oot nod.",1
"what do you mean
","Ondes and Hcild Nodse are arranged / sorted based on name (A - Z) fater eahc action (add, edlete and renaem )",0
Can I set specific  execution time for the test cases?,can i set specific software execution run time for these the test cases?,1
yes.,You can login with your userntaJme and pDasswsord,0
"Thank you this sugguest!
",of how can i find back the input classification file?,0
"Right now, we only accept JSON file.
","right from now, tomorrow we would only accept json file.",1
"Sorry, now we only support adding category names to each node.
","sorry, now nodes only support new category names in each node.",1
"Delete action is hard delete. I.e., you cannot view the test case once deleted.
",explain how best to delete nodes from input classification?,0
"Sorry, we don't have this option right now. If you have more question, please contact admin.
","sorry, we don't have any option available anymore. if patrons have no question, please call admin.",1
During which stage?,During which tage?,1
"In Input tree modeling we are defining the factors which need to be considered while testing a certain product.  We use this tree while defining the test case group and to generate the test cases Test Case Input modeling refers to Data/Input Data required for the test case. In this module, we are providing the user ability to add input data to the test case either manually or with the help of a web search engine
","In Inptu tree modeling we are defining the factors which ened to be considered while testing a cetrian product. We use this tree while defining the etst acse gorup and to generate the test cases Test Csae Input modeling refers to Data / Input Adta required for the tets case. In this module, we are providing the suer ability to add input data to the test case either manually or with the help of a web search engine",1
"There is no nodes limitationn.
",each is standard nodes limitationn.,1
"Sure.There is a plus(+) symbol on the popup window. With this you can add as many nodes required, then click create to add nodes to the tree.
","Sur. Ther is a plus (+) symbol on the ppup indow. With thi you can add as mny nodes reured, then lick creat to add nodes to the ree.",1
"The tree should have only three levels. There is no limit on the number of nodes and child nodes. Higher the nodes more number of test cases will be generated.
",go ahead to login → get started → process data in administration,0
"Sure. Navigation : Login → Get Started → DATA ADMINISTRATION WITH GRAPH Move mouse over the node.Right click on it and option to delete the node will be displayed
",Sur)e. Navigation: !Login → Get Start(e$d → DATA ADMINISTRATION WITH GaRAPH pMove mouse ovger the node. Right click on it and option to delAete the vnode will be di2splay^ed,1
"I am afraid you can't do it online. Because in the online editing, we only allow to add one and only one root node.","i smile hoping they can't believe it yet. even in the online editing, we only need to add one and drop one root node.",1
"Yes, no problem.
",programs can function this output tree to minimize the expected output.,0
"I wasn't able to create and delete a node from input inclassification, can you help me?","users can normally create an output output tree or output argument tree can be generated automatically manually based on the input tree and context tree. however once the “ test language case functional group ” a is so created, users can edit input, context and output trees.",0
"For adding nodes, you can go Go to Login → Get Started → DATA ADMINISTRATION WITH GRAPH Move the mouse over the node.Right click on it and select “Create Child Node” option.A popup window will open. Add name for the node and click create.","For adding nodes, you can go Go to Login → Get Started → DATA ADMIINSTRATOIN WITH GRAPH Move the omuse oevr the onde. Rigth click on it and seelct “ Cretae Chlid Node ” option. A popup window will opne. Add name for the node and click rceate.",1
"Yes, Thank you very much.
",how is the solar tree produced?,0
"Go to  Login → Get Started → DATA ADMINISTRATION WITH GRAPH
",Got it! Wi ll too m any n odes affect efficiency?,0
 You can limit the number of test cases by limiting the number of nodes in input and context tree.,You can limit the number of tset casse by ilmiitng the nubmer of nodes in inptu and context rtee.,1
How can I upload my input classification?,how can i upload this job classification?,1
Sure. You can choose to upload files or create online.,Wha are the maximum child nodes for the rents ndes (child nods for Invalid; cild odes for Valid )?,0
Can I create my context tree offline and then upload the file?,can i create my context description tree directly offline and just then easily upload the file?,1
Like is it restorable?,are they serious about the tree?,0
"We have no plan for it yet
",• can i customize any data context tree?,0
"No, Thanks for your help.
",Can multCipZle users modify the sa4me application input and context cl^assificwatQioNn input?,0
Great! Do you mean each node represents a context feature?,The question is inte resting.,0
No,...,1
How can I reset my password? I can’t remember my password. ,how can i change the password? i can t t remember any password.,1
Can I download the context tree I built on the app?,Can I downod the context tre I bilt on the app?,1
 Currently the app is in the development stage. So the performance capabilities are limited and not supported.,and currently the app is already in the development stage. even so the performance monitoring capabilities are limited and sometimes not supported.,1
"You can customize your context features by simply changing the labels of nodes, adding or deleting nodes in the context tree.","You can custom ize yo ur context fe atures by simply changing the labels of nodes, adding or dele ting nodes in the con text t ree.",1
"There is no limit to the number of nodes in the context tree, but you can only have one root.
","there is no true limit to the relative number field of nodes in all the context tree, but you actually can obviously only have one root.",1
"No, one user can’t login with multiple browser.
","yes, all will indeed! so far, no context node generally supports 3 frames. when designing the context tree, become careful to ensure level restriction.",0
How can I fix the previous information when I am at the output stage?,thanks for their help.,0
"Sure.There is a plus(+) symbol on the popup window. With this you can add as many nodes required, then click create to add nodes to the tree.
","sure. there appears no plus ( + ) key in the following section. then this one should add as many nodes required, then click create to access nodes to the tree.",1
"Hello, I can’t find my testing cases? Can you help me?","Helol, I can ’ t fidn my etstign acses? Can you help me?",1
"In our application, each child node can have and only have one parent node.",Why thngs not working whe I try to add more nods at one?,0
Can we specify the weights on the edge of the tree?,yes. he should have stayed helpful with my password.,0
How can I control the test cases number of each test case branch?,How can I control the tets caess number of each test acse brnach?,1
"There are two methods: Go to Login → Get Started → DATA ADMINISTRATION WITH GRAPH Move the mouse over the node.Right click on it and select   1. “Create Child Node” option.A popup window will open. There is a plus(+) symbol on the popup window. With this you can add as many nodes required,then click create to add nodes to the tree. OR’ 2. “Create 5 Nodes” option to add five child nodes with default names. Then select the node to rename with appropriate values
","there are two methods : go to login → get started project → data administration with a graph move the mouse over the node. right click on touching it and clicking select 1. “ create child node ” option. a popup window will open. there is a plus ( + ) symbol on the a popup window. with this you can add as your many parent nodes required, then you click create to add nodes to the tree. or ’ 2. “ just create 5 nodes are ” option to add five child nodes with default names. then select the node to rename with appropriate values",1
"Move mouse over the node. Right click on it and option to delete the node will be displayed.
",initial application output is generated shortly after the execution schedule of test cases.,0
Would you give me more specific information about it?,could you give me enough specific advice about it?,1
"Nothing will happen.
",the test tree should naturally have only those three distinct levels. there is no limit on the number of nodes and child input nodes. higher the three nodes more no of the test cases will naturally be so generated. so if not possible create trees with key values.,0
"Sure.""For creating node:Go to Login → Get Started → DATA ADMINISTRATION WITH GRAPH Move the mouse over the node.Right click on it and select “Create Child Node” option.A popup window will open. Add name for the node and click create.""","previous information already mentioned previous stages, like analysis and contect data.",0
"Correct, with using the same input and context group.",can i skip this release time for the test cases?,0
"No
",f,1
Go to Login → Get Started → DATA ADMINISTRATION WITH GRAPH Select tree/file from dropdown list. Tree will be displayed.,maybe for real? like as many days as i really want?,0
Why things not working when I adding more level for my input classification tree?,“ create 5 nodes ” option 5 to add five child nodes with 2 default last names. then select selecting the node next to you rename with other appropriate values,0
I can’t login with my account and password. ,"great more question! the more greater the number levels of nodes, the more exact test cases which will be generated next and the much longer attempts it will all take. so if possible create a tree with their necessary key values.",0
"Yes for sure, could you please clarify 'previous information'?",How may conens can I add to my conex?,0
What can I do if I want to rename my node?,Wh at can I do if I want to re name my n ode?,1
"Yes. After you save it, we can download the corresponding json file generated by the app.",where do you suggest not trying to use this?,0
"There is no limit on the number of nodes and child nodes. Higher the nodes more no of test cases will be generated.So if possible create trees with key values.
",Tere is no limit to the number of chld nods.,0
"No problem. Just let you know, when you rename a node, the order of nodes will be automatically sorted by new name (A-Z).
",m no,0
"Yep! Each node in the context tree stands for a context feature you designed. Besides, just let you know, you can enter subnodes as subfeatures as well.
","No, de lete action is h ard delete.",0
"Application output is generated after the execution of test cases.
",screen move mouse over the node. choose right move click button on it and option error to delete the node will then be displayed.,0
 Is there some templates available for reference?,instead i just tried hard to rearrange the sorted order of child nodes stored in my memory tree but failed. can you help make me figure it out?,0
What can I do if I want to check my input classification cases?,"I am a fraid you can ' t do it onli ne. B ecause in the on line editi ng, we o nly a llow to add one and o nly one root node.",0
In our system menu? Do you need navigations?,in our system perhaps? do i need it?,1
What is the difference between test case input modeling and input tree modeling?,What is the dsiffevrUence between tewst casue inpaut modeling and input tree modeling?,1
Expected output is generated from output tree and stored as tree (similar to the input and context tree).,this output is generated from output tree or represented as tree ( up to kernel function and context tree ).,1
"Alternatively, You can delete the extra test cases
","i am okay, the reply is yes.",0
"No
",Lairght. Do you know how amny nodes can I neter for my niput classificaiton? Is htere any limiatitno?,0
"Move mouse over the node. Right click on it and option to delete the node will be displayed.
",what was the difference between illusion output and true output?,0
"No, we don't have such option.
","no, we d'no have such conditions.",1
 Yes. I should have something wrong with my password.,Navi3gati*o*n: Login → Get *StartWed → DATA ADMINISTRATION WCITH GRAPOH Msove mouyse ove3r the node. Right click on it and op9tion to delete the node twill be displayed,0
In our system menu? Do you need navigations?,as in what our system menu? where do you need navigations?,1
