Question_1,Question_2,flag
"In our application, each child node can have and only have one parent node.","like our scheme, the child node can have and only have 2 parent node.",1
What to do with deleting nodes from input calssficaition.,Hwat to do with edletnig noeds from input calssficaition.,1
 Do you suggest not to use this?,do now suggest not... use this?,1
What does copying tree for?,What does coypign tree for?,1
Can I recover deleted nodes?,I can ’ t naswer,0
What actions can I do to a node in the context tree?,What a ctions can I do to a node in the co ntext t ree?,1
Where can I check my testing tree?,where can i find my memory tree?,1
Where to check the test case execution status?,"Sorry, we don ' t support thiCs option. But you can upl7oad your own JSOPN ingput cla+ssfici6acVti)on flile.",0
"The release date is not determined yet
",Mov+e mo_use over the Tnode. Righqt click on it and option to delete the node wi!ll be disnpglayed.,0
Application output as the output for the final stage?,Aplicato outut as the output for the final tage?,1
How many child nodes can I enter for my input classification?,How any child node can I ener for my input classification?,1
"No, Thanks for your help.
","No, Htanks for your hepl.",1
You mean if I refresh I will lose what I have built so far!?,these mean if it refresh i will lose that should have built so great!?,1
"Go to  Login → Get Started → Test Case Group
",where you need words to go in navigation : login - > end get started - > data center administration with graph. wrong move mouse over from the node. right click on to it again and option 8 to delete the node will be displayed.,0
"You can find the contact information in the webpage
","just, just don't have much function.",0
Can I use scratch input classification files?,can say i really use scratch input classification files?,1
Can I input the limitation number?,2. click wrist and hand hold to move tree branches around.,0
"Yes, you are right! So far, our context tree only supports 3 levels. When designing the context tree, be careful to the level restriction.
","Yes, you are right! So far, our context tre only upprts 3 leels. Wen desinng the cntex tre, be reful to the levl restriction.",1
"There is no nodes limitationn.
",Sure. But don ' t forget to sve yor canes.,0
I can’t find the delete button for input classification nodes?,No,0
"Yes, it will be delivered soon
",go reverse login the get started → data administration equals graph. no tree / file or dropdown task.,0
"Sure. You can upload your own tree by using JSON file.
",SurWe. You can upload your own tbree by &using JSON file.,1
"Like, is it string, integer, or what?","like, is is it a string, integer, or say what?",1
Can I build two separate context trees in the file? ,can i really build with two entirely separate context trees in the file?,1
Deleted from the Test Case Group?,"Hi, I ca nnot add a c hild n ode to the 4th le vel of the c ontext tree. How can I fix t his?",0
"Oh, sorry to inform you that our context tree only supports up to 3 levels of design. I am afraid you have to get rid of the 4th level or simplify your design to 3 levels. ","Oh, sorry to iform you tat our context tre onl supports up to 3 level of dsign. I am afraid you have to get rid of the 4th lvel or smplif your deign to 3 leves.",1
"Yes, I am.","so yes, i am.",1
What's the maximum depth of the context tree?,Do you hve a JSO file?,0
"Yes
","I tried to upload a Jason *file, wher(e can I see my tepsVting Etree?",0
"Thanks for your help.
",how can i fix on previous information as i am at an output counter?,0
Do you know where I can find my input testing cases?,Is ther3e any naming convention?,0
How can I do the version control of the input and context classification input?,could you also explain in more precise detail?,0
"Could you elaborate a bit more on ""separate context trees"" you mentioned ?","could one elaborate their bit longer than "" separate context trees "" you mentioned?",1
"Yes, you can.
","The more nodes, the more tst cass wll be generated. It wil tak a oooong time. So if posibe delete some redundant noes and just retain the key oes.",0
"In our application, each child node can have and only have one parent node.",Why things not worki ng wh en I try to add m ore nodes at on ce?,0
Where can I find the deleted test case?,here can I find the delet test case?,1
"Not exactly. The same directory stays open only if you only use this app.
",how consistently can grade i control the test cases number size of each test case by branch?,0
"Hello, how can I edit my nodes for input classification? Sure, you can edit or delete nodes. How many nodes can I add at most in one time?","Helol, how can I eidt my nodes for inptu calssiicfation? Suer, you can edit or delete ndoes. How mayn nodes can I add at mots in one tmie?",1
"We will consider the schedule function
",We will consider the scheudel function,1
"The tree should have only three levels. There is no limit on the number of nodes and child nodes. Higher the nodes more number of test cases will be generated.
",you're really welcome!,0
Is there any limitation for creating nodes for input classification?,expected output evaluation is generated from the output value tree.,0
How to delete nodes from input classification?,whether to delete nodes during input classification?,1
"Absolutely! There are two ways: First move your mouse over the node, right click then select ‘create child node’ option. A popup window will open. There is a plus(+) symbol on the popup window. With this you can add as many nodes required, then click create to add nodes to the tree. The second way is move your mouse over the node, right click then select ‘create 5 nodes’ option to add five child nodes with default names. Then select the node to rename with appropriate values. Thank you! Can I upload my input classification?",for output 0?,0
"The output tree can be auto generated or the user can manually create the tree.
","Mouse hov ers on a node and right cli ck, t hen the option list wi ll appear.",0
"Yes, Thanks. Can I change the color of node?","yes, thanks. can she change the color for her?",1
"Yes. You can upload a JSON file.
",yes. you can upload back a master json configuration file.,1
I didn't. Do I need to rebuild it from scratch?,I didn ' t. Do I n eed to re build it fr om scra tch?,1
"Please  click the ‘CONTACT’ button in the left panel
",Ple(ase click the ‘ CONTACT ’ butt+on in the leOft panel,1
What are the maximal test cases can be executed when the app performance is tested?,Can I upolad my own SJON file as ipnut classification and content classiifcaiton?,0
"You can organize your context features into a tree structure level by level. A parent node presents a context feature, and a child node presents a subfeature of that context feature.
",Corre ct.,0
There is a ‘create 5 Nodes’ option to add five child nodes with default names. Then you can select the node to rename with appropriate values.,like at the house.,0
"The order of nodes at each level will be automatically sorted based on name (A-Z) after each action. The order doesn't affect test cases generation.
",The order of nodes at ech lvel wil be automatically sorted based on nam (A - Z) fter each actin. The order doesn ' t affet est cases gneraio.,1
No. This feature will need to be developed.,no. this organization will offer to continue developed.,1
Where can I find the deleted test case?,"Oh, sorry to i nform you that our conte xt tr ee on ly supports up to 3 leve ls of design. I am a fraid you have to get rid of the 4th level or si mplify yo ur de sign to 3 l evels.",0
"Go to  Login → Get Started → DATA ADMINISTRATION WITH GRAPH. Drag and rearrange nodes feature is available . 
",i even can ’ t answer,0
"Yes, you are right! So far, our context tree only supports 3 levels. When designing the context tree, be careful to the level restriction.
","Yes, you are rigt! So far, our context tree nly uppors 3 evels. Wen designing the conte tree, be crefu to the leel rstrcton.",1
"You're welcome.
",you'cal re welcome.,1
 We are in the process of reconfiguring the UI this feature will be removed,The tree sohuld have only there levels. There is no liimt on the number of nodse and hcild nodes. Higher the nodse mroe no of tset cases wlil be generated. So if possible create trese with key values.,0
"Absolutely! There are two ways: First move your mouse over the node, right click then select ‘create child node’ option. A popup window will open. There is a plus(+) symbol on the popup window. With this you can add as many nodes required, then click create to add nodes to the tree. The second way is move your mouse over the node, right click then select ‘create 5 nodes’ option to add five child nodes with default names. Then select the node to rename with appropriate values. Thank you! Can I upload my input classification?","Absolutely! There are two ways: First move your mouse over the node, right clicLk then sel$ect ‘ create child nodhe ’ option. A popup window Nwill open. Ther@e is a plus (+) symbo)l on the popnup window. With this you can add as many nodes required, then click create to add nodes to the tree. The second way is move pyour mouse over the node, right click tahen select ‘ create 5 nodes ’ opstion to add five child nodes with default names. Then select the node to rename with appropriate values. Thank you! Can I upload my input classification?",1
"We plan to do that later
",We plZan to do that later,1
 Currently we do not have this facility. Users will need to contact the admin,How to fix submission button doens ' t owrk?,0
"It’s used to copy the whole content of current version for producing a new version by modification
",It ’ s used to ocpy the whoel content of current evrsino for prdoucnig a new rvesion by modification,1
"Yes
",can i download the tree tree i built for the phone?,0
"The tree should have only three levels. There is no limit on the number of nodes and child nodes. Higher the nodes more number of test cases will be generated.
",The tere shoudl haev noly three levels. There is no limit on the number of nodes and child nodes. Highre the nodes moer number of tets casse will be generated.,1
"Ok, got it! I will modify it.",am i understand,0
"There is no limit. You can add child nodes as needed. 
",what is the impact it if somehow the component test tools are used together by multiple users for different app apps at the same loading time?,0
Could you please clarify what do you by the type?,could you please clarify what she do by your type?,1
I can't rename my node?,i can'u t rename that my node?,1
"Yes, you do need to do that.
","Yes, you do ne ed to do t hat.",1
"What’s the performance test do you mean?
",Waht ’ s the perfromance tets do you mean?,1
How many nodes can I enter for my input classification?,Can I set specific ex3ecutioEn tiSme for the test 7cases?,0
JSON file,"No, one user can ’ t loign with mlutipel rbwoser.",0
"Navigation : Login → Get Started → DATA ADMINISTRATION WITH GRAPH. Hover mouse on the target node, and right click. You'll see the corresponding options.
","translation : login must be started → run administration process graph. first mouse on the target keyboard, hold right click. you'll write the corresponding options.",1
What’s the recommended number of input features for a context tree? Is there any limit?,should multiple users have a device and work together?,0
"Sure, Navigation : Login → Get Started → DATA ADMINISTRATION WITH GRAPH  Move mouse over the node.Right click on it and option to delete the node will be displayed
","second, navigation : loop click get start → data administration with graph move mouse over the node. right → push it or try to scan the path will be displayed",1
"Go to  Login → Get Started → DATA ADMINISTRATION WITH GRAPH. Drag and rearrange nodes feature is available . 
",Our systm doesn ' t hav nodes limitationn.,0
" Input and context tree modeling,Test case modeling and Test case input modeling.","mouse click scroll to zoom - in and zoom - us out off the tree, or click on and just hold to still move tree around.",0
"I don't know
",or do i print the context files? can you provide a template?,0
"Previous information are the previous stages, like input and contect stages.","sure. "" for every node : go to login → get started → data access with graph move the mouse over the node. right next to it and clicked “ create a node ” option. then popup window will follow. add name upon a node and click create. """,0
"Sorry, we don’t have this option.",Currnelty no,0
Where can I store the output information?,where can but i store the output as information?,1
"I tried to upload a Jason file, where can I see my testing tree?",Yes,0
"While building the context tree, my web page was frozen. what should I do?","after building another green tree, one final page was frozen. what should i do?",1
Can I add multiple nodes to my context tree at once?,can i add multiple tree nodes to my context file tree almost at once?,1
What if I accidentally deleted the whole test case?,Did you s ave it? You can only re store i nfo from the sa ved tree.,0
Can I use my previous trees?,I don ' t nkow,0
Can we customize property to each node?,we can ’ to t do that,0
"No.
",No.,1
"I am sorry. Users are not allowed to do that directly. Nodes and child Nodes are sorted based on name (A-Z) after each action (add, delete and rename).
","I am so rry. Us ers are not allowed to do th at directly. No des and chi ld Nod es are sorted ba sed on name (A - Z) after ea ch ac tion (add, del ete and rename ).",1
"Navigation : Login → Get Started → DATA ADMINISTRATION WITH GRAPH Move mouse over the node.Right click on it and option to delete the node will be displayed
",¿ can mine do if you want to determine my input classification cases?,0
"The tree should have only three levels. There is no limit on the number of nodes and child nodes. Higher the nodes more number of test cases will be generated.
",some tree should feature only three peaks. there is another limit in the number intermediate nodes over child nodes. higher the nodes maximum number of test cases will are generated.,1
"Great question! The greater the number of nodes, the more test cases will be generated and the longer it will take. So if possible create a tree with necessary key values.
","great more question! the more greater the number levels of nodes, the more exact test cases which will be generated next and the much longer attempts it will all take. so if possible create a tree with their necessary key values.",1
How to add or delete node from input classification?,there simply is no good such limitationn.,0
"Yes, it is like what does it stored as?","I am sory, the anwer is YES.",0
"No
",I can ’ t find the deilete buttYon for input classification lnodes?,0
"I tried to add forth level, but not working.","sam paused to add forth level, but no working.",1
"I am sorry to hear that
",i am sorry to say that,1
"Actually, there is no restrictions. However, more nodes will take more time to generate test cases and modeling inputs.
",i couldn't know,0
"Sorry, we don't have this option right now. If you have more question, please contact admin.
","sorry, we still don't have any this other option right of now. if you now have one more question, please contact admin.",1
Yes please., Not exatl. The sam directory stys opn oly if you only use this app.,0
"Yes, you can go to Login-> Get Started -> TEST CASE GROUP, then select appropriate test case group, scroll to right till you see the action column. Hover over each action button to see the description, click ‘View Test Cases’. Then you will be redirected to input test cases. Did I solve your problem?",I don ' t unde*rsta4n(d,0
During which stage?,... great. how can google map nodes from input classification?,0
What kinds of tests can be done with this tool?,what kinds of things were being done with this tool?,1
What does copying tree for?,can anyone merge the values at clouds 2 and cloud 3 in my context tree?,0
"Oh, thanks. Clear instructions.",its release price is not determined yet,0
"I understand
",I undetr6stanLd,1
Would you give me more specific information about it?,are you worrying about adding nodes in input and matrix?,0
"Nodes and Child Nodes are arranged/sorted based on name(A-Z) after each action(add,delete and rename)",then could will you please provide clarification?,0
"No problem. Just let you know, when you rename a node, the order of nodes will be automatically sorted by new name (A-Z).
","oh no problem. just let you know, when you rename of a given node, the total order of nodes will be then automatically sorted out by new vertex name ( not a - not z ).",1
"“Create 5 Nodes” option to add five child nodes with default names. Then select the node to rename with appropriate values
",were things not working when i could more level for my input through tests?,0
"Yes, thank you. How can I delete my saved trees?",Yes,0
Sounds great. How can I delete nodes from input classification?,BSounds great. How can I delete nkodes !from input classification?,1
Yes.,Yes.,1
"Sure. You can upload your own tree by using JSON file.
",How can I do the rvesion control of the inupt and ocnetxt lcassfiicaiotn input?,0
Could you provide some examples?,ould you provide some examples?,1
"Sorry, now we only support adding category names to each node.
","sorry, now we only generally support adding category member names equally to each node.",1
" Input and context tree modeling,Test case modeling and Test case input modeling.","I wasn ' t abl&e to crea9te and delete a node fro7m i!nput ilnclOasusific#ation, can you hxelp me?",0
How can I delete nodes from input classification?,How can I delete nqodes from Binput classification?,1
"We will issue new resources once core functionality is built.
",We wlil issue new resources once core functinaoilty is ubilt.,1
"Sorry, we don't accept image file right now, but you can upload JSON file.",I am not sYure,0
It’s needed to simplify the work,"i am removed. users are not allowed 2 do anything anymore. should not child avoid being sorted based on name ( a - n ) after each action ( restore, delete and rename ).",0
"Exactly. The operation is the same.
",1. the operation is the truth.,1
Can I upload my own JSON file as input classification and content classification?,the output tree can be locally generated through the developer can also create the tree.,0
"No difference
",No diZfDfekrence,1
Is there any naming convention for the file?,is there any naming agreement for the species?,1
"No
",Do you havEe any Mmore question?,0
You can mode mouse over the node. Right click on it and option to delete the node will be displayed.,absolutely right.,0
"I don't know
",how can operator i immediately organize the model context with features? can you provide a template?,0
"No.
",trans.,1
Over 100 nodes.,Over 100 nods.,1
"Actions, such as add, delete, rename and etc. You can find different actions in the option list. ","Actions, uch as add, elete, renae and etc. You can ind dfferen actions in the ption list.",1
How to delete nodes from input classification?,How to delete #nodes fr3om input classification?,1
"Go to  Login → Get Started → DATA ADMINISTRATION WITH GRAPH Select tree/file from dropdown list. Tree will be displayed.
",go to file → request started → use request with like select tree / file or dropdown list. page will be displayed.,1
It’s necessary for team cooperation.,It ’ s necTenssary for team cdooperat^io%n.,1
Can I input the limitation number?,can she input the limitation files?,1
"Yes, you can go to Login-> Get Started -> TEST CASE GROUP, then select appropriate test case group, scroll to right till you see the action column. Hover over each action button to see the description, click ‘View Test Cases’. Then you will be redirected to input test cases. Did I solve your problem?
","Yes, you can go to Lovgin -> Get Starutexd -> TEST CASE GROUP, hthen select appropriate test case group, scroll to right till you see the action column. Hover Xover each action button to see the desc#ripKtioHn, click ‘ View Teswt Case&s ’. Then you wiall be redirected to in2put teZst cases. Did I solve your problem?",1
What functions are supported by the tool?,what functions are represented throughout the tool?,1
 Is there template available for reference?,is there template content available available for reference?,1
So I can’t test NLP applications. Is it right?,is i the simple way to merge two merged trees? i don't bother to construct either merged tree from scratch.,0
Like is it restorable?,"Gret question! The greater the nmber of odes, the mre tet cses ill be generated and the longer it will take. So if posibe create a tree wth ncessay key values.",0
Can multiple users share a project and work together?,Can multi8pl%e usezrs share a project and work Ft2ogether?,1
"There is no limit on the number of nodes and child nodes. Higher the nodes more no of test cases will be generated.So if possible create trees with key values.
","I mea the nod etail, sch as creation time, last modification ime, numer of children and etc.",0
 We are in the process of reconfiguring the UI this feature will be removed,We are in the proc0es_s of XrecobnKfiguring the UI this YfeaturEe will be YremoveMd,1
You mean if I refresh I will lose what I have built so far!?,"Sor ry, I don ' t unders tand you questi on.",0
"I tried to add forth level, but not working.","I tr0ied to add fourth level, but not wBoxrking.",1
How can I organize the context features? Can you provide a template?,How can I oranie the ontex features? Can you rvide a emplat?,1
Can we customize property to each node?,and users customize property to each node?,1
"We will check it.
","great problem! the greater the number number nodes, the less test at will were generated while the longer it can see. what if you create a tree with necessary key values.",0
Could you please explain what do you mean by version?,"yes, thank god you. how can i never delete my ever saved fruit trees?",0
Can multiple users modify the same application input and context classification input?,Move mouse ovjer the no7de. RYight click on it and optio8n to delete the node wiGll be dis#playeid.,0
Can I set specific  execution time for the test cases?,Can I set spZecifWic execution time for the tegst casJes?,1
"There is no limit. You can add child nodes as needed. 
",there is obviously no limit. you each can add up child nodes as needed.,1
No.,No.,1
"We will issue new resources once core functionality is built.
",sure. you just choose to change files or create notes.,0
Deleted from the Test Case Group?,Deleted from the Test ase Grou?,1
 Can user use same login with currently with multiple browser?,can user perform same function with currently available multiple browser?,1
"Exactly. The operation is the same.
",Expected output is ge nerated from the output tree once “ genera te t est ca ses ” action t riggered. If th is action is inte rrupted th en test case generation will be t erminated.,0
"Thank you for your help.
",How can I dlete a ode?,0
"You can customize your context features by simply changing the labels of nodes, adding or deleting nodes in the context tree.
",I mean in eneral.,0
What actions can I do to a node in the context tree?,f,0
Are you looking for recovery?,may humans define input of file as content classification?,0
What is test case modeling?,What is test acse modeling?,1
Can I merge the nodes at level 2 and level 3 in my context tree?,can i formally merge the nodes at level 2 again and a level of 3 in my context tree?,1
"If I accidently delete the node, can I recover it?","If I accdiently dleete the node, can I recoerv it?",1
"Go to  Login → Get Started → DATA ADMINISTRATION WITH GRAPH
",go to login → move started → calculate transaction with graph,1
"Thank you for your help.
",Thank you for yur help.,1
How can I achieve it?,How can I achie it?,1
No.Also User should not use same login with currently with multiple browser.,no. also user account should only not too use same via login with currently with multiple browser.,1
"I mean the node detail, such as creation time, last modification time, number of children and etc.",Th ere is no limit on the nu mber of nod es and c hild n odes. Hig her the nodes mo re no of te st cases wi ll be generated. So if possible create tre es with key values.,0
I think it is very useful function if the test cases are huge and avoid workload traffic,so hope traffic is very useful function if the test cases is huge and avoid traffic traffic,1
"JSON. You should build your context tree as a json file.
",JSON. You sh ould bu ild your context tree as a js on file.,1
"Navigation : Login → Get Started → DATA ADMINISTRATION WITH GRAPH. Hover mouse on the target node, and right click. You'll see the corresponding options.
","Navigation: ogin → Get Started → DAA ADMINISTRATION ITH GRAH. Hover mouse on the targt nod, and riht cick. You ' ll see the coespoding options.",1
"Great question! The greater the number of nodes, the more test cases will be generated and the longer it will take. So if possible create a tree with necessary key values.
",Go to ogin → Get tartd → Test Case Grou,0
"Yes, you do need to do that.
","i don't know do i create a computer node from input classification, could we make people?",0
"Move mouse over the node. Right click on it and option to delete the node will be displayed.
","sorry, now don't truly understand his question.",0
